[
  {
    "id": "FU-2",
    "title": "No subcommand to append a new step mid-phase",
    "kind": "cli-ergonomics",
    "status": "wontfix",
    "priority": "eventually",
    "context": "`state.py append-record steps.json '{...}'` exists (covers PLAN-time and in principle mid-phase). The original framing was specifically about EXECUTE-time step creation; `instructions/execute.md` still funnels deferred work through devlog `Deferred:` flags so PLAN owns step authoring. If a real workflow demands runtime step append from EXECUTE, lift the restriction in execute.md prose - the CLI now supports it.",
    "trigger": "Phase 2 pilot shows execute-time step append is wanted; loosen the prose.",
    "closed": "2026-07-02",
    "resolution": "No occurrence. Steps sit below the executing model cognitive limit (no ask-too-large failures); discovered/extra work is handled by devlog `Deferred:` -> PLAN re-authors, so EXECUTE never needs to append a step. PLAN-owns-steps is a deliberate guardrail. (Occasional long / calls-limit steps are a step-sizing + multi-iteration-budget concern, i.e. Phase 3.C -- not this.) Reopen only if a real workflow proves EXECUTE-time step append is needed."
  },
  {
    "id": "FU-3",
    "title": "`state.py set` only handles JSON object files, not arrays",
    "kind": "cli-ergonomics",
    "status": "closed",
    "priority": "icebox",
    "context": "`update-record` (added for review/close authoring) covers single-record updates on array files via `--match KEY=VALUE`. Generic-set-on-array still isn't supported (e.g., updating fields on N records at once).",
    "trigger": "A real workflow needs bulk update across multiple records (rare). Until then, `update-record` covers the gap that drove FU-3 in practice.",
    "closed": "2026-07-02",
    "resolution": "Practical gap -- updating fields on array-file records -- is covered by `update-record` (single record, matched by KEY=VALUE); `set` did not need extending. Only unbuilt remainder is bulk update across N records at once: no occurrence, scriptable as a loop of `update-record` calls; file fresh if ever needed."
  },
  {
    "id": "FU-4",
    "title": "No named lifecycle-transition op (e.g., `state.py escalate --reason \"...\"`)",
    "kind": "cli-ergonomics",
    "status": "wontfix",
    "priority": "icebox",
    "context": "Post-FU-30 the `blocked` field is gone; lifecycle transitions use `state.py set project.json state=<enum>`. The dense `set` syntax works for autonomous and supervised use alike. A named op like `state.py escalate --reason \"...\"` (or `state.py raise-gate`) could log a structured reason and read more naturally, but adds API surface for little gain.",
    "trigger": "Revisit if supervised UI grows a need for richer transition flows.",
    "closed": "2026-07-02",
    "resolution": "Lifecycle transitions already work via `state set project.json state=<enum>`, and the escalation reason is already captured in a devlog entry. A named op (escalate/raise-gate) just merges two calls into one nicer command -- sugar that adds API surface for little gain (FU-4 own assessment). Reopen only if a supervised write-surface (deferred indefinitely today) creates real demand."
  },
  {
    "id": "FU-14",
    "title": "No read-side query helper in `state.py` (e.g., `state.py query devlog.jsonl --where 'contracts != []'`)",
    "kind": "cli-ergonomics",
    "status": "closed",
    "priority": "eventually",
    "context": "The assembler (Phase 1.3) exposes pre-formatted views: `--section devlog --phase N` gives a bulleted phase tail, `--section status` an orientation snapshot. Ad-hoc queries still fall back to `jq`. Per ARCH §2 / §10, the assembler intentionally does not absorb general-purpose queries.",
    "trigger": "Phase 2 pilot reveals a repeated query pattern worth absorbing into `--section`.",
    "refs": [
      "FU-39"
    ],
    "resolution": "Largely obviated. Common read patterns are now first-class control CLI projections (i2c status / devlog --phase N / decisions --phase N / escalation / logs) -- none existed when FU-14 was filed. Arbitrary ad-hoc queries stay jq by design (ARCH section 2 / section 10: do not absorb general-purpose queries). Trigger obsolete -- FU-39 removed the operator --section modes. File fresh if a specific repeated query pattern proves worth its own projection.",
    "closed": "2026-07-02"
  },
  {
    "id": "FU-15",
    "title": "`Module Contract` section is hard-required when `phases.json[current].module` is set",
    "kind": "other",
    "status": "wontfix",
    "priority": "icebox",
    "context": "Per ARCH §11.1 / §4.1, the assembler exits 1 if a phase declares a `module` field but no `ARCH_<module>.md` file exists. This is strict by spec — useful for catching missing contracts early — and the FU-32 Δ4 ARCH-authoring discipline (per `ref/SPEC_architecture.md`) now codifies pre-authoring as the standard: every module's ARCH is written during architecture-phase work *before* any PLAN runs on that phase. **Original CC pilot (2026-06-05)** workaround (pre-author `ARCH_resolver.md` at bootstrap) is now the documented norm rather than a workaround.",
    "trigger": "Only revisit if a future workflow genuinely needs to plan against an unwritten ARCH (e.g., research/spike phases). For now the strictness is correct.",
    "refs": [
      "FU-32"
    ],
    "resolution": "Resolved as correct-by-design: the hard-require catches missing module contracts early, and the FU-32 Delta-4 ARCH-authoring discipline makes pre-authoring each module ARCH the standard (was a workaround, now the norm). The strictness stands -- no change wanted. Reopen only for a workflow that must plan against an unwritten ARCH (research/spike phases).",
    "closed": "2026-07-02"
  },
  {
    "id": "FU-16",
    "title": "Available Modules ARCHITECTURE.md fallback is naive",
    "kind": "cli-ergonomics",
    "status": "open",
    "priority": "icebox",
    "context": "When the adapter's `## Available Modules` section is placeholder-only, the assembler grabs `## Implementation Sequence` from `ARCHITECTURE.md` verbatim and surfaces its body. If projects use richer Implementation Sequence tables (extra columns, longer prose), the rendered Available Modules section will be noisy.",
    "trigger": "Phase 2 / 3 pilots show real-world Implementation Sequence tables overflow the section. Tighten the fallback to extract only module names, or document a project convention for the fallback shape.",
    "files": [
      "i2c/assemble_context.py"
    ]
  },
  {
    "id": "FU-18",
    "title": "Assembler tests slow on Windows network share",
    "kind": "test-hardening",
    "status": "closed",
    "priority": "next",
    "context": "`tests/test_assemble_context.py` runs in ~60s on `\\\\192.168.0.50\\shared\\...`. Primary cost: `TempProject(with_framework=True)` copies the full `instructions/` directory and WORKER_SPEC + both adapters per test invocation.",
    "trigger": "If iteration cost becomes painful, refactor `TempProject` to copy only what each test class needs (most renderer tests don't read instructions), or cache the framework copy per pytest session. Not a correctness issue.",
    "files": [
      "tests/test_assemble_context.py"
    ],
    "closed": "2026-07-02",
    "resolution": "Cached the fixture + adapter files locally once per process; tests copytree from the local cache instead of the Samba share on every test. test_assemble_context.py: ~60s -> ~20s (110 tests, ~3x). Follow-up shipped (df8698e): extracted the cache into shared tests/_fixtures.py and routed all 9 fixture-copying suites through it; full suite ~260s -> ~194s. Fully resolved."
  },
  {
    "id": "FU-32",
    "title": "Autonomous PLAN via ARCH-driven step decomposition (deltas 1-4 shipped)",
    "kind": "other",
    "status": "closed",
    "priority": "icebox",
    "context": "After CC Phase 4 EXECUTE shipped supervised (commit `97e9ea4`), the meta-question surfaced: i2c's autonomous loop runs EXECUTE/REVIEW/CLOSE cleanly, but PLAN's step-breakdown step still requires human authoring because ARCH files aren't constrained enough to drive mechanical step decomposition. e2e solves this via a two-step workflow (pre-arch design separately, autonomous batch implementation); i2c lacks the ARCH-authoring discipline and the safety-net escalation triggers that make autonomous PLAN safe. Five deltas identified — see the progress log below for current state and the Δ5 spec.",
    "trigger": "Continue with CC Phase 5+ ARCH authoring against the new template; Δ5 follows once the template is validated.",
    "resolution": "Delivered. Deltas 1-4 shipped 2026-06-09; validated on clankercourts (13 Pattern-A ARCHes, Phases 2-14 autonomous). Delta5 (ARCH-completeness precondition) declined as specced -- no occurrence, and the original spec would false-halt successful phases (ARCH_resolver/validator ran fine without Escalation-Triggers). File-fresh-if-needed: (a) a `## Phasing`-only soft check, only for undisciplined external/migrated ARCHes; (b) Pattern-B autonomous validation, exercised when diplomat/phosphene migrate.",
    "closed": "2026-07-02"
  },
  {
    "id": "FU-40",
    "title": "Centralize commits in the deterministic runner (worker stops running git)",
    "kind": "structural-refactor",
    "status": "closed",
    "priority": "next",